[
  {
    "name": "login_bruteforce",
    "domain": "identity",
    "severity": 0.82,
    "mitre": [
      "T1110"
    ],
    "stride": [
      "Spoofing"
    ],
    "kill_chain": [
      "Reconnaissance",
      "Delivery"
    ],
    "compliance": [
      "CIS:Mitigation5",
      "ISO27001.A.9"
    ],
    "diamond": {
      "adversary": null,
      "capability": "credential_guessing",
      "infrastructure": "auth_service",
      "victim": null
    },
    "dread": {
      "damage": 7,
      "repro": 6
    }
  },
  {
    "name": "suspicious_iam_activity",
    "domain": "identity",
    "severity": 0.86,
    "mitre": [
      "T1609"
    ],
    "stride": [
      "Elevation",
      "Repudiation"
    ],
    "kill_chain": [
      "Installation"
    ],
    "compliance": [
      "ISO27001.A.9"
    ],
    "diamond": {
      "adversary": null,
      "capability": "privilege_abuse",
      "infrastructure": "iam_service",
      "victim": null
    },
    "dread": {
      "damage": 8,
      "repro": 7
    }
  },
  {
    "name": "suspicious_ssh_key_upload",
    "domain": "identity",
    "severity": 0.91,
    "mitre": [
      "T1098"
    ],
    "stride": [
      "Spoofing",
      "Repudiation"
    ],
    "kill_chain": [
      "Installation"
    ],
    "compliance": [
      "ISO27001.A.9",
      "NIST-RMF:IDENTIFY"
    ],
    "diamond": {
      "adversary": null,
      "capability": "persistence",
      "infrastructure": "auth_service",
      "victim": null
    },
    "dread": {
      "damage": 8,
      "repro": 7
    }
  },
  {
    "name": "credential_reuse_from_honeypot",
    "domain": "identity",
    "severity": 0.93,
    "mitre": [
      "T1078"
    ],
    "stride": [
      "Repudiation"
    ],
    "kill_chain": [
      "CredentialAccess"
    ],
    "compliance": [],
    "diamond": {
      "adversary": null,
      "capability": "credential_reuse",
      "infrastructure": "auth_service",
      "victim": null
    },
    "dread": {
      "damage": 8,
      "repro": 7
    }
  },
  {
    "name": "anomalous_geolocation",
    "domain": "identity",
    "severity": 0.64,
    "mitre": [],
    "stride": [
      "Spoofing"
    ],
    "kill_chain": [
      "Reconnaissance"
    ],
    "compliance": [],
    "diamond": {
      "adversary": null,
      "capability": "remote_access",
      "infrastructure": "ip_space",
      "victim": null
    },
    "dread": {
      "damage": 4,
      "repro": 3
    }
  },
  {
    "name": "login_bruteforce",
    "domain": "identity",
    "severity": 0.82,
    "mitre": [
      "T1110"
    ],
    "stride": [
      "Spoofing"
    ],
    "kill_chain": [
      "Reconnaissance",
      "Delivery"
    ],
    "compliance": [
      "CIS:Mitigation5",
      "ISO27001.A.9"
    ],
    "diamond": {
      "adversary": null,
      "capability": "credential_guessing",
      "infrastructure": "auth_service",
      "victim": null
    },
    "dread": {
      "damage": 7,
      "repro": 6
    }
  },
  {
    "name": "suspicious_iam_activity",
    "domain": "identity",
    "severity": 0.86,
    "mitre": [
      "T1609"
    ],
    "stride": [
      "Elevation",
      "Repudiation"
    ],
    "kill_chain": [
      "Installation"
    ],
    "compliance": [
      "ISO27001.A.9"
    ],
    "diamond": {
      "adversary": null,
      "capability": "privilege_abuse",
      "infrastructure": "iam_service",
      "victim": null
    },
    "dread": {
      "damage": 8,
      "repro": 7
    }
  },
  {
    "name": "suspicious_ssh_key_upload",
    "domain": "identity",
    "severity": 0.91,
    "mitre": [
      "T1098"
    ],
    "stride": [
      "Spoofing",
      "Repudiation"
    ],
    "kill_chain": [
      "Installation"
    ],
    "compliance": [
      "ISO27001.A.9",
      "NIST-RMF:IDENTIFY"
    ],
    "diamond": {
      "adversary": null,
      "capability": "persistence",
      "infrastructure": "auth_service",
      "victim": null
    },
    "dread": {
      "damage": 8,
      "repro": 7
    }
  },
  {
    "name": "credential_reuse_from_honeypot",
    "domain": "identity",
    "severity": 0.93,
    "mitre": [
      "T1078"
    ],
    "stride": [
      "Repudiation"
    ],
    "kill_chain": [
      "CredentialAccess"
    ],
    "compliance": [],
    "diamond": {
      "adversary": null,
      "capability": "credential_reuse",
      "infrastructure": "auth_service",
      "victim": null
    },
    "dread": {
      "damage": 8,
      "repro": 7
    }
  },
  {
    "name": "anomalous_geolocation",
    "domain": "identity",
    "severity": 0.64,
    "mitre": [],
    "stride": [
      "Spoofing"
    ],
    "kill_chain": [
      "Reconnaissance"
    ],
    "compliance": [],
    "diamond": {
      "adversary": null,
      "capability": "remote_access",
      "infrastructure": "ip_space",
      "victim": null
    },
    "dread": {
      "damage": 4,
      "repro": 3
    }
  },
  {
    "name": "multiple_failed_2fa_attempts",
    "domain": "identity",
    "severity": 0.8,
    "mitre": [],
    "stride": [
      "Spoofing"
    ],
    "kill_chain": [
      "Reconnaissance"
    ],
    "compliance": [
      "ISO27001.A.9"
    ],
    "diamond": {
      "adversary": null,
      "capability": "credential_guessing",
      "infrastructure": "auth_service",
      "victim": null
    },
    "dread": {
      "damage": 7,
      "repro": 6
    }
  },
  {
    "name": "abnormal_service_account_usage",
    "domain": "identity",
    "severity": 0.88,
    "mitre": [],
    "stride": [
      "Repudiation"
    ],
    "kill_chain": [
      "Installation"
    ],
    "compliance": [
      "ISO27001.A.9"
    ],
    "diamond": {
      "adversary": null,
      "capability": "privilege_abuse",
      "infrastructure": "iam",
      "victim": null
    },
    "dread": {
      "damage": 8,
      "repro": 7
    }
  },
  {
    "name": "credential_stuffing_detected",
    "domain": "identity",
    "severity": 0.86,
    "mitre": [
      "T1110"
    ],
    "stride": [
      "Spoofing"
    ],
    "kill_chain": [
      "Reconnaissance"
    ],
    "compliance": [
      "CIS:Mitigation5"
    ],
    "diamond": {
      "adversary": null,
      "capability": "credential_attack",
      "infrastructure": "auth_service",
      "victim": null
    },
    "dread": {
      "damage": 8,
      "repro": 6
    }
  },
  {
    "name": "unexpected_service_account_changes_2",
    "domain": "identity",
    "severity": 0.88,
    "mitre": [],
    "stride": [
      "Repudiation"
    ],
    "kill_chain": [
      "Installation"
    ],
    "compliance": [
      "ISO27001.A.9"
    ],
    "diamond": {
      "adversary": null,
      "capability": "account_tamper",
      "infrastructure": "iam",
      "victim": null
    },
    "dread": {
      "damage": 8,
      "repro": 7
    }
  },
  {
    "name": "failed_logon_from_unusual_region",
    "domain": "identity",
    "severity": 0.72,
    "mitre": [],
    "stride": [
      "Spoofing"
    ],
    "kill_chain": [
      "Reconnaissance"
    ],
    "compliance": [],
    "diamond": {
      "adversary": null,
      "capability": "remote_access",
      "infrastructure": "ip_space",
      "victim": null
    },
    "dread": {
      "damage": 5,
      "repro": 4
    }
  },
  {
    "name": "access_to_deleted_account_resources",
    "domain": "identity",
    "severity": 0.88,
    "mitre": [],
    "stride": [
      "Repudiation"
    ],
    "kill_chain": [
      "CredentialAccess"
    ],
    "compliance": [
      "ISO27001.A.9"
    ],
    "diamond": {
      "adversary": null,
      "capability": "account_abuse",
      "infrastructure": "iam",
      "victim": null
    },
    "dread": {
      "damage": 8,
      "repro": 7
    }
  }
]